CUSTKEY,C_COMMENT,C_ACCTBAL,C_PHONE,C_ADDRESS,C_NAME,NATIONKEY,MKTSEGMENT
2,l accounts. blithely ironic theodolites integrate boldly: caref,121.65,23-768-687-3665,"XSTf4,NCwDVaWNe6tEgvwfmRchLXak",Customer#000000002,13.0,AUTOMOBILE
3," deposits eat slyly ironic, even instructions. express foxes detect slyly. blithely even accounts abov",7498.12,11-719-748-3364,MG9kdTD2WBHm,Customer#000000003,1.0,AUTOMOBILE
4," requests. final, regular ideas sleep final accou",2866.83,14-128-190-5944,XxVSJsLAGtn,Customer#000000004,4.0,MACHINERY
5,n accounts will have to unwind. foxes cajole accor,794.47,13-750-942-6364,KvpyuHCplrB84WgAiGV6sYpZq7Tj,Customer#000000005,3.0,HOUSEHOLD
6,tions. even deposits boost according to the slyly bold packages. final accounts cajole requests. furious,7638.57,30-114-968-4951,"sKZz0CsnMD7mp4Xd0YrBvx,LREYKUWAh yVn",Customer#000000006,20.0,AUTOMOBILE
